{
  "schema": "baozi-scale-policy/v1",
  "artifact_schema": "baozi-scale-report/v1",
  "profile_id": "u3-obj-import-v1",
  "execution": {
    "collection_timeout_seconds": 2400,
    "tool_timeout_seconds": 30,
    "metadata_timeout_seconds": 120,
    "criterion_timeout_seconds": 900,
    "probe_build_timeout_seconds": 600,
    "max_stdout_bytes": 16777216,
    "max_stderr_bytes": 16777216
  },
  "criterion": {
    "expected_version": "0.5.1",
    "expected_source": "registry+https://github.com/rust-lang/crates.io-index",
    "benchmark_group": "obj_face_import_scale",
    "warm_up_seconds": 1,
    "measurement_seconds": 3,
    "sample_size": 20,
    "resamples": 2000,
    "time_slope_advisory_exponent": 1.25
  },
  "rss": {
    "tool": "/usr/bin/time",
    "repetitions": 3,
    "probe_timeout_seconds": 180,
    "growth_factor_per_decade": 12.0,
    "growth_slack_bytes": 8388608,
    "ledger_multiplier": 1.25,
    "fixed_allowance_bytes": 16777216,
    "max_rss_bytes": 1073741824
  },
  "cases": [
    {
      "case_id": "obj_repeated_triangle_faces",
      "scales": [1, 10, 100, 1000],
      "selected_1000x": true,
      "fixture": {
        "base_face_count": 256,
        "peak_fixed_bytes": 8388608,
        "peak_bytes_per_input_byte": 16,
        "peak_bytes_per_face": 2048
      }
    }
  ]
}
